"They are both in love with each other, but love is not enough to make them stay together. They separate and then meet again. The girl has become a boy and the boy has become a girl.",1
"a young couple that hates each other, a young couple that falls in love, a young couple that is separated, and a young couple that is reunited. You must use the word ""lovers"" in the story. You are only allowed to use the vocabulary word that matches the prompt.
Write a fast-paced story about a young couple that hates each other. The story must have a beginning, middle, and end, and must use the vocabulary words you have learned in this module.
Write a fast-paced story about a young couple that falls in love. The story must have a beginning, middle, and end, and must use the vocabulary words you have learned in this module.
Write a fast-paced story about a young couple that is separated. The story must have a beginning, middle, and end, and must use the vocabulary words you have learned in this module.
Write a fast-paced story about a young couple that is reunited. The story must have a beginning, middle, and end, and must use the vocabulary words you have learned in this module.
Write a fast-paced story about a young couple that works at a restaurant. The story must have a beginning, middle, and end, and must use",0
"Her parents were poor, and her father, a carpenter, was a member of the Communist Party. In a landslide victory, the Communist Party dominated the elections. The army was ordered to shoot down the demonstrators.",1
"a man and a woman who are attracted to each other, and who have a physical relationship.In the light of the current situation regarding the coronavirus, Vifor Pharma has taken the necessary precautions to protect its employees and ensure the continued availability of products.Serbia’s President Aleksandar Vucic has vowed to “cleanse” the country’s judiciary of officials loyal to the former Serbian strongman Slobodan Milosevic, whom he said were behind a corruption scandal that led to the arrest of three high-ranking judges.
Mr. Vucic, who took office last year, said on Tuesday that he has decided to remove these judges from office and transfer them to other positions, after the country’s anti-corruption agency announced on Monday that it had arrested three judges for corruption.
Critics say his decision is aimed at removing judges with whom he has a personal enmity. Mr. Vucic, for example, is a major opponent of former prime minister Vojislav Kostunica. Mr. Kostunica is a former ally of Milosevic, the country’s former strongman, who was arrested in 2001 by the government of then-President Boris Tadic. He died in the",0
"a girl who can see the future and a boy who makes her fall in love.
The first necessary thing to do is to write a story about lovers: a girl who can see the future and a boy who makes her fall in love. This is a very important step in the process of writing this text because it is necessary to know the names of the characters, their profession, the place where they live, etc. In addition, it is necessary to know the main conflict and the goal of each character. It is also necessary to know the ending of the story, because it is important to know where the story will end and if the ending will be satisfactory to the reader.
When writing a story about lovers, it is necessary to take into account that the characters are not only lovers, but also live in a certain time and space. It is necessary to describe the characters in detail, because they are the key to the success of the story, and it is important to know the feelings of characters and their goals. It is also important to describe the actions of a character in detail, because the story must show what characters do.There are a few things that you can do to become more successful when you are trying to sell your home,",0
"a story of two two two two two two two two two two two two two two two two two five.Para el interior de la casa, se optó por un estilo rústico moderno, que se lograra con un estilo más minimalista, pero sin perder el toque boho chic.
Se utilizaron muebles y accesorios de madera, texturas, colores neutros y muy pocos accesorios de decoración.La evolución de la industria de la construcción en Chiapas, se puede observar en el cuadro 2.1, que muestra el valor de la obra pública...
A continuación tiene un análisis sobre las tendencias de la industria del cemento en Colombia para el 2018. La industria del cemento en Colombia,...""No tengo intención de renunciar"", sostuvo el mandatario, quien se limitó a decir que todas esas denuncias buscan perjudicarlo en el marco de las elecciones generales de 2014, a las que el jefe de Estado se presentará como candidato a la reelección.
""No hay ninguna prueba, no hay nada de eso. Yo no tengo nada que ocultar"", añadió el presidente, quien afirmó que los supuestos actos de corrupción que le adjudican ""no son para nada"" ilegales.
El pasado lunes, el diario O Estado de Sao Paulo publicó un extenso reportaje según el cual la",0
"Mr. and Mrs. Smith. The student will be able to write about 15 sentences about love.
Write a story about a special present that they received. The student will be able to write about 20 sentences.
Write a story about a new family member. The student will be able to write about 15 sentences about their pet.
Write a story about a family trip. The student will be able to write about 15 sentences about their favorite family trip.
Write a story about a family reunion. The student will be able to write about 15 sentences about a family reunion.
Write a story about a family holiday. The student will be able to write about 15 sentences about a family holiday.
Write a story about a family gathering. The student will be able to write about 15 sentences about a family gathering.
Write a story about a family vacation. The student will be able to write about 15 sentences about a family vacation.
Write a story about a family outing. The student will be able to write about 15 sentences about a family outing.
Write a story about a family party. The student will be able to write about 15 sentences about a family party.
Write a story about a family trip. The student will be able to write about 15 sentences about",0
"Hussein and Nour: Hussein and Nour are two young children, who love each other very much. Hussein lives in the city of Baghdad, while Nour lives in the city of Basra. They love each other so deeply that they want to live together forever. They go to the parents of each child and ask them to marry them. The parents agree to marry them if they have some money to buy a house for the two of them.",1
"romance, suspense, or mystery. Readers of this particular writing style will be looking for a fast-paced story with lots of action and emotion. The goal is to keep the story moving at a fast pace, but to do so without sacrificing character development or storytelling. In this story, the pace of the story is more important than the plot.
Write a slow-paced story about lovers: romance, suspense, or mystery. This style of writing is primarily character-driven, and lacks the fast-paced action found in a story with a fast-paced plot. The pace of the story is more important than the plot.
Write an action-packed story about lovers: romance, suspense, or mystery. Readers of this particular writing style will be looking for a fast-paced story with lots of action and emotion. The goal is to keep the story moving at a fast pace, but to do so without sacrificing character development or storytelling. In this story, the pace of the story is more important than the plot.
Write a character-driven story about lovers: romance, suspense, or mystery. Readers of this particular writing style will be looking for a story with characters who are strong, believ",0
"how you met, what you like/dislike about each other, and how you spend time together. Remember, your story needs to be very fast-paced, because a reader will be able to read a word a minute. Go!
Write a scene in which your character is involved in an accident, fire, or other emergency (no matter how unlikely). Include a description of the situation and the character’s thoughts and feelings. Go!
Write a story about a character who is swapping minds with someone else. What problems does the character have? What problems does the other person have? How do they get their minds back? Go!
Write a story about a character who has a great idea. This could be about a new invention or an art project or other creation. Tell the reader about the idea, and how it came to be. Go!
Write a story about a character who falls in love with an object. Who is the object? Where does the character meet it? How does the character’s love for the object change over time? Go!
Write a story about a character who is in trouble. This character could be in trouble with the law, in trouble with a teacher or a boss, in trouble with another student or teacher,",0